# name: test/sql/local/catalog_test_config_setup/catalog_agnostic/transactions/test_snapshot_operation_in_transaction.test
# description: Test that snapshot operation type is correctly passed through transactions
# group: [transactions]

require-env CATALOG_TEST_CONFIG_SETUP

require avro

require parquet

require iceberg

require httpfs

# Do not ignore 'HTTP' error messages!
set ignore_error_messages

statement ok
set enable_logging=true

statement ok
set logging_level='debug'

# Create a fresh table
statement ok
DROP TABLE IF EXISTS my_datalake.default.test_txn_operation_type;

statement ok
CREATE TABLE my_datalake.default.test_txn_operation_type (id INTEGER, value VARCHAR);

# Test INSERT in explicit transaction produces correct operation type (append)
statement ok
begin transaction;

statement ok
INSERT INTO my_datalake.default.test_txn_operation_type VALUES (1, 'a'), (2, 'b'), (3, 'c');

statement ok
commit;

query II
select sequence_number, operation from iceberg_snapshots(my_datalake.default.test_txn_operation_type) order by sequence_number;
----
1	append

# Test DELETE in explicit transaction produces correct operation type (delete)
statement ok
begin transaction;

statement ok
DELETE FROM my_datalake.default.test_txn_operation_type WHERE id = 2;

statement ok
commit;

# Verify: one append and one delete
query II
select sequence_number, operation from iceberg_snapshots(my_datalake.default.test_txn_operation_type) order by sequence_number;
----
1	append
2	delete

# Verify final state
query II
select * from my_datalake.default.test_txn_operation_type order by id;
----
1	a
3	c
