# name: test/sql/local/catalog_test_config_setup/catalog_agnostic/transactions/test_transactional_deletes_not_retried.test
# group: [transactions]

require-env CATALOG_TEST_CONFIG_SETUP

require avro

require parquet

require iceberg

require httpfs

# Do not ignore 'HTTP' error messages!
set ignore_error_messages

statement ok
create schema if not exists my_datalake.default;

statement ok
drop table if exists my_datalake.default.multi_transaction_delete;

statement ok
create table my_datalake.default.multi_transaction_delete (
	a int,
	b int
);

# Insert 0,0
statement ok
insert into my_datalake.default.multi_transaction_delete VALUES
	(0, 0);

statement ok con1
begin

statement ok con2
begin

# Insert 2,2
statement ok con2
insert into my_datalake.default.multi_transaction_delete VALUES
	(2, 2);

statement ok con2
commit

# con1 doesn't see 2,2 yet
query II con1
select * from my_datalake.default.multi_transaction_delete;
----
0	0

# con1 can't delete because its transactional doesn't see the latest state
statement error con1
delete from my_datalake.default.multi_transaction_delete where a = 0;
----
TransactionContext Error: Write-write conflict detected on 'default.multi_transaction_delete', changes were made since the start of the transaction

statement error con1
select count(*) from my_datalake.default.multi_transaction_delete;
----
TransactionContext Error: Current transaction is aborted (please ROLLBACK)

statement ok con1
commit;

# con1 DELETE didn't go through
query II
select * from my_datalake.default.multi_transaction_delete order by all
----
0	0
2	2
