# name: test/sql/local/catalog_test_config_setup/catalog_agnostic/insert/test_insert_into_sorted_table_fails.test
# group: [insert]

require-env CATALOG_TEST_CONFIG_SETUP

require avro

require parquet

require iceberg

require httpfs

require tpch

# Do not ignore 'HTTP' error messages!
set ignore_error_messages

statement ok
set enable_logging=true

statement ok
set logging_level='debug'


statement ok
call dbgen(sf=0.001);

statement error
insert into my_datalake.default.table_sort_order select * from lineitem limit 5;
----
<REGEX>:.*Not implemented Error.*INSERT into a sorted iceberg table is not supported yet.*

# With the unsafe override enabled, the INSERT succeeds. The written data is
# not sorted by the table's declared sort order, which the Iceberg spec permits
# (writers are not required to honour the declared order, and readers do not
# assume files are sorted).
# Wrap in a transaction so the row-count assertions below stay stable.
statement ok
BEGIN;

statement ok
SET unsafe_iceberg_ignore_sort_order=true;

statement ok
insert into my_datalake.default.table_sort_order select * from lineitem limit 5;

statement ok
ABORT;

statement ok
SET unsafe_iceberg_ignore_sort_order=false;

# Without the override the guard still applies
statement error
insert into my_datalake.default.table_sort_order select * from lineitem limit 5;
----
<REGEX>:.*Not implemented Error.*INSERT into a sorted iceberg table is not supported yet.*

statement ok
BEGIN;

query I
select count(*) from my_datalake.default.table_sort_order;
----
60175

statement ok
delete from my_datalake.default.table_sort_order where l_orderkey > 20;

query I
select count(*) from my_datalake.default.table_sort_order;
----
25

statement ok
ABORT;

