# name: test/sql/local/irc/delete/test_deletes_from_multiple_files.test
# description: Test ducklake deleting multiple batches
# group: [delete]

require-env ICEBERG_SERVER_AVAILABLE

require avro

require parquet

require iceberg

require httpfs

# Do not ignore 'HTTP' error messages!
set ignore_error_messages

statement ok
CALL enable_logging('HTTP');

statement ok
set logging_level='debug'

statement ok
CREATE SECRET (
    TYPE S3,
    KEY_ID 'admin',
    SECRET 'password',
    ENDPOINT '127.0.0.1:9000',
    URL_STYLE 'path',
    USE_SSL 0
);


statement ok
ATTACH '' AS my_datalake (
    TYPE ICEBERG,
    CLIENT_ID 'admin',
    CLIENT_SECRET 'password',
    ENDPOINT 'http://127.0.0.1:8181'
);

statement ok
create schema if not exists my_datalake.default;

statement ok
DROP TABLE IF EXISTS my_datalake.default.test;

statement ok
CREATE TABLE my_datalake.default.test AS SELECT i id FROM range(5000000) t(i);

query I
select count(*) from iceberg_metadata(my_datalake.default.test);
----
3

statement ok
delete from my_datalake.default.test where id in (10000, 3000000, 4800000);

# Expect 3 delete files, one for every data file
query I
select count(*) from iceberg_metadata(my_datalake.default.test) where manifest_content = 'DELETE';
----
3

# write a test to make sure only 2 delete files are rewritten and one stays the same
# also write a test to figure out how to do equality deletes.
query I
select 1;
----
0

statement ok
delete from my_datalake.default.test where id in (10001, 4800001);

# Expect 3 delete files, one for every data file
query I
select count(*) from iceberg_metadata(my_datalake.default.test) where manifest_content = 'DELETE';
----
3

