# name: test/sql/local/catalog_test_config_setup/catalog_agnostic/delete/test_delete_dv_merge_runtime_filter.test
# description: DML whose scan receives a runtime (dynamic) filter must still merge existing deletion vectors
# group: [delete]

require-env CATALOG_TEST_CONFIG_SETUP

require avro

require parquet

require iceberg

require httpfs

# Do not ignore 'HTTP' error messages!
set ignore_error_messages

statement ok
DROP TABLE IF EXISTS my_datalake.default.test_dv_merge_runtime_filter;

statement ok
CREATE TABLE my_datalake.default.test_dv_merge_runtime_filter (id INT, val VARCHAR) WITH ('format-version'='3');

statement ok
INSERT INTO my_datalake.default.test_dv_merge_runtime_filter VALUES
    (1, 'a'), (2, 'b'), (3, 'c'), (4, 'd'), (5, 'e');

# The first delete writes a deletion vector for the data file
statement ok
DELETE FROM my_datalake.default.test_dv_merge_runtime_filter WHERE val = 'a';

query II
SELECT * FROM my_datalake.default.test_dv_merge_runtime_filter ORDER BY id;
----
2	b
3	c
4	d
5	e

# The hash join generates a dynamic min/max filter that is pushed into the probe side scan
# at runtime.
statement ok
UPDATE my_datalake.default.test_dv_merge_runtime_filter SET val = val || '_updated'
FROM (VALUES (2), (3)) t(uid) WHERE id = t.uid;

query II
SELECT * FROM my_datalake.default.test_dv_merge_runtime_filter ORDER BY id;
----
2	b_updated
3	c_updated
4	d
5	e

statement ok
DROP TABLE my_datalake.default.test_dv_merge_runtime_filter;
